{
  "schema": "teistro-conformance/baseline-rashi-dashas/1",
  "fixture": "charts/c034-tehran-1979-02-11.json",
  "provenance": {
    "source": "baseline-engine",
    "evidence_rank": 2,
    "engine_version": "1.8.0",
    "exporter_version": "1.0.0",
    "inputs": "the fixture's input.resolved.jd_ut, foundation.lagna.sign_index, foundation.arudha_lagna_sign_index, foundation.navamsha_lagna_sign_index, and positions.bodies.*.sign_index and .dignity"
  },
  "year_length_days": 365.25,
  "inputs": {
    "jd_ut": 2443915.8541666665,
    "lagna_sign_index": 1,
    "arudha_lagna_sign_index": 3,
    "navamsha_lagna_sign_index": 1,
    "graha_sign_index": {
      "SUN": 9,
      "MOON": 3,
      "MARS": 9,
      "MERCURY": 10,
      "JUPITER": 3,
      "VENUS": 8,
      "SATURN": 4,
      "RAHU": 4,
      "KETU": 10
    },
    "graha_dignity": {
      "SUN": "GREAT_ENEMY",
      "MOON": "OWN_SIGN",
      "MARS": "EXALTED",
      "MERCURY": "ENEMY",
      "JUPITER": "EXALTED",
      "VENUS": "ENEMY",
      "SATURN": "GREAT_ENEMY",
      "RAHU": "NEUTRAL",
      "KETU": "NEUTRAL"
    }
  },
  "reference_instants_jd": [2453915.8541666665, 2461287.5],
  "systems": {
    "chara": {
      "tree_depth": 2,
      "row_format": ["path", "sign_index", "lord", "start_jd", "end_jd"],
      "periods": [
        ["0", 1, "VENUS", 2443915.8541666665, 2446472.6041666665],
        ["0/0", 1, "VENUS", 2443915.8541666665, 2444128.9166666665],
        ["0/1", 0, "MARS", 2444128.9166666665, 2444341.9791666665],
        ["0/2", 11, "JUPITER", 2444341.9791666665, 2444555.0416666665],
        ["0/3", 10, "RAHU", 2444555.0416666665, 2444768.1041666665],
        ["0/4", 9, "SATURN", 2444768.1041666665, 2444981.1666666665],
        ["0/5", 8, "JUPITER", 2444981.1666666665, 2445194.2291666665],
        ["0/6", 7, "KETU", 2445194.2291666665, 2445407.2916666665],
        ["0/7", 6, "VENUS", 2445407.2916666665, 2445620.3541666665],
        ["0/8", 5, "MERCURY", 2445620.3541666665, 2445833.4166666665],
        ["0/9", 4, "SUN", 2445833.4166666665, 2446046.4791666665],
        ["0/10", 3, "MOON", 2446046.4791666665, 2446259.5416666665],
        ["0/11", 2, "MERCURY", 2446259.5416666665, 2446472.6041666665],
        ["1", 0, "MARS", 2446472.6041666665, 2449759.8541666665],
        ["1/0", 0, "MARS", 2446472.6041666665, 2446746.5416666665],
        ["1/1", 1, "VENUS", 2446746.5416666665, 2447020.4791666665],
        ["1/2", 2, "MERCURY", 2447020.4791666665, 2447294.4166666665],
        ["1/3", 3, "MOON", 2447294.4166666665, 2447568.3541666665],
        ["1/4", 4, "SUN", 2447568.3541666665, 2447842.2916666665],
        ["1/5", 5, "MERCURY", 2447842.2916666665, 2448116.2291666665],
        ["1/6", 6, "VENUS", 2448116.2291666665, 2448390.1666666665],
        ["1/7", 7, "KETU", 2448390.1666666665, 2448664.1041666665],
        ["1/8", 8, "JUPITER", 2448664.1041666665, 2448938.0416666665],
        ["1/9", 9, "SATURN", 2448938.0416666665, 2449211.9791666665],
        ["1/10", 10, "RAHU", 2449211.9791666665, 2449485.9166666665],
        ["1/11", 11, "JUPITER", 2449485.9166666665, 2449759.8541666665],
        ["2", 11, "JUPITER", 2449759.8541666665, 2452681.8541666665],
        ["2/0", 11, "JUPITER", 2449759.8541666665, 2450003.3541666665],
        ["2/1", 10, "RAHU", 2450003.3541666665, 2450246.8541666665],
        ["2/2", 9, "SATURN", 2450246.8541666665, 2450490.3541666665],
        ["2/3", 8, "JUPITER", 2450490.3541666665, 2450733.8541666665],
        ["2/4", 7, "KETU", 2450733.8541666665, 2450977.3541666665],
        ["2/5", 6, "VENUS", 2450977.3541666665, 2451220.8541666665],
        ["2/6", 5, "MERCURY", 2451220.8541666665, 2451464.3541666665],
        ["2/7", 4, "SUN", 2451464.3541666665, 2451707.8541666665],
        ["2/8", 3, "MOON", 2451707.8541666665, 2451951.3541666665],
        ["2/9", 2, "MERCURY", 2451951.3541666665, 2452194.8541666665],
        ["2/10", 1, "VENUS", 2452194.8541666665, 2452438.3541666665],
        ["2/11", 0, "MARS", 2452438.3541666665, 2452681.8541666665],
        ["3", 10, "RAHU", 2452681.8541666665, 2454873.3541666665],
        ["3/0", 10, "RAHU", 2452681.8541666665, 2452864.4791666665],
        ["3/1", 11, "JUPITER", 2452864.4791666665, 2453047.1041666665],
        ["3/2", 0, "MARS", 2453047.1041666665, 2453229.7291666665],
        ["3/3", 1, "VENUS", 2453229.7291666665, 2453412.3541666665],
        ["3/4", 2, "MERCURY", 2453412.3541666665, 2453594.9791666665],
        ["3/5", 3, "MOON", 2453594.9791666665, 2453777.6041666665],
        ["3/6", 4, "SUN", 2453777.6041666665, 2453960.2291666665],
        ["3/7", 5, "MERCURY", 2453960.2291666665, 2454142.8541666665],
        ["3/8", 6, "VENUS", 2454142.8541666665, 2454325.4791666665],
        ["3/9", 7, "KETU", 2454325.4791666665, 2454508.1041666665],
        ["3/10", 8, "JUPITER", 2454508.1041666665, 2454690.7291666665],
        ["3/11", 9, "SATURN", 2454690.7291666665, 2454873.3541666665],
        ["4", 9, "SATURN", 2454873.3541666665, 2456699.6041666665],
        ["4/0", 9, "SATURN", 2454873.3541666665, 2455025.5416666665],
        ["4/1", 8, "JUPITER", 2455025.5416666665, 2455177.7291666665],
        ["4/2", 7, "KETU", 2455177.7291666665, 2455329.9166666665],
        ["4/3", 6, "VENUS", 2455329.9166666665, 2455482.1041666665],
        ["4/4", 5, "MERCURY", 2455482.1041666665, 2455634.2916666665],
        ["4/5", 4, "SUN", 2455634.2916666665, 2455786.4791666665],
        ["4/6", 3, "MOON", 2455786.4791666665, 2455938.6666666665],
        ["4/7", 2, "MERCURY", 2455938.6666666665, 2456090.8541666665],
        ["4/8", 1, "VENUS", 2456090.8541666665, 2456243.0416666665],
        ["4/9", 0, "MARS", 2456243.0416666665, 2456395.2291666665],
        ["4/10", 11, "JUPITER", 2456395.2291666665, 2456547.4166666665],
        ["4/11", 10, "RAHU", 2456547.4166666665, 2456699.6041666665],
        ["5", 8, "JUPITER", 2456699.6041666665, 2459256.3541666665],
        ["5/0", 8, "JUPITER", 2456699.6041666665, 2456912.6666666665],
        ["5/1", 9, "SATURN", 2456912.6666666665, 2457125.7291666665],
        ["5/2", 10, "RAHU", 2457125.7291666665, 2457338.7916666665],
        ["5/3", 11, "JUPITER", 2457338.7916666665, 2457551.8541666665],
        ["5/4", 0, "MARS", 2457551.8541666665, 2457764.9166666665],
        ["5/5", 1, "VENUS", 2457764.9166666665, 2457977.9791666665],
        ["5/6", 2, "MERCURY", 2457977.9791666665, 2458191.0416666665],
        ["5/7", 3, "MOON", 2458191.0416666665, 2458404.1041666665],
        ["5/8", 4, "SUN", 2458404.1041666665, 2458617.1666666665],
        ["5/9", 5, "MERCURY", 2458617.1666666665, 2458830.2291666665],
        ["5/10", 6, "VENUS", 2458830.2291666665, 2459043.2916666665],
        ["5/11", 7, "KETU", 2459043.2916666665, 2459256.3541666665],
        ["6", 7, "KETU", 2459256.3541666665, 2460352.1041666665],
        ["6/0", 7, "KETU", 2459256.3541666665, 2459347.6666666665],
        ["6/1", 6, "VENUS", 2459347.6666666665, 2459438.9791666665],
        ["6/2", 5, "MERCURY", 2459438.9791666665, 2459530.2916666665],
        ["6/3", 4, "SUN", 2459530.2916666665, 2459621.6041666665],
        ["6/4", 3, "MOON", 2459621.6041666665, 2459712.9166666665],
        ["6/5", 2, "MERCURY", 2459712.9166666665, 2459804.2291666665],
        ["6/6", 1, "VENUS", 2459804.2291666665, 2459895.5416666665],
        ["6/7", 0, "MARS", 2459895.5416666665, 2459986.8541666665],
        ["6/8", 11, "JUPITER", 2459986.8541666665, 2460078.1666666665],
        ["6/9", 10, "RAHU", 2460078.1666666665, 2460169.4791666665],
        ["6/10", 9, "SATURN", 2460169.4791666665, 2460260.7916666665],
        ["6/11", 8, "JUPITER", 2460260.7916666665, 2460352.1041666665],
        ["7", 6, "VENUS", 2460352.1041666665, 2461082.6041666665],
        ["7/0", 6, "VENUS", 2460352.1041666665, 2460412.9791666665],
        ["7/1", 7, "KETU", 2460412.9791666665, 2460473.8541666665],
        ["7/2", 8, "JUPITER", 2460473.8541666665, 2460534.7291666665],
        ["7/3", 9, "SATURN", 2460534.7291666665, 2460595.6041666665],
        ["7/4", 10, "RAHU", 2460595.6041666665, 2460656.4791666665],
        ["7/5", 11, "JUPITER", 2460656.4791666665, 2460717.3541666665],
        ["7/6", 0, "MARS", 2460717.3541666665, 2460778.2291666665],
        ["7/7", 1, "VENUS", 2460778.2291666665, 2460839.1041666665],
        ["7/8", 2, "MERCURY", 2460839.1041666665, 2460899.9791666665],
        ["7/9", 3, "MOON", 2460899.9791666665, 2460960.8541666665],
        ["7/10", 4, "SUN", 2460960.8541666665, 2461021.7291666665],
        ["7/11", 5, "MERCURY", 2461021.7291666665, 2461082.6041666665],
        ["8", 5, "MERCURY", 2461082.6041666665, 2463639.3541666665],
        ["8/0", 5, "MERCURY", 2461082.6041666665, 2461295.6666666665],
        ["8/1", 4, "SUN", 2461295.6666666665, 2461508.7291666665],
        ["8/2", 3, "MOON", 2461508.7291666665, 2461721.7916666665],
        ["8/3", 2, "MERCURY", 2461721.7916666665, 2461934.8541666665],
        ["8/4", 1, "VENUS", 2461934.8541666665, 2462147.9166666665],
        ["8/5", 0, "MARS", 2462147.9166666665, 2462360.9791666665],
        ["8/6", 11, "JUPITER", 2462360.9791666665, 2462574.0416666665],
        ["8/7", 10, "RAHU", 2462574.0416666665, 2462787.1041666665],
        ["8/8", 9, "SATURN", 2462787.1041666665, 2463000.1666666665],
        ["8/9", 8, "JUPITER", 2463000.1666666665, 2463213.2291666665],
        ["8/10", 7, "KETU", 2463213.2291666665, 2463426.2916666665],
        ["8/11", 6, "VENUS", 2463426.2916666665, 2463639.3541666665],
        ["9", 4, "SUN", 2463639.3541666665, 2466196.1041666665],
        ["9/0", 4, "SUN", 2463639.3541666665, 2463852.4166666665],
        ["9/1", 5, "MERCURY", 2463852.4166666665, 2464065.4791666665],
        ["9/2", 6, "VENUS", 2464065.4791666665, 2464278.5416666665],
        ["9/3", 7, "KETU", 2464278.5416666665, 2464491.6041666665],
        ["9/4", 8, "JUPITER", 2464491.6041666665, 2464704.6666666665],
        ["9/5", 9, "SATURN", 2464704.6666666665, 2464917.7291666665],
        ["9/6", 10, "RAHU", 2464917.7291666665, 2465130.7916666665],